{
  "$schema": "../schemas/chain-source.schema.json",
  "schema_version": 1,
  "slug": "monad",
  "verified_at": "2026-08-30",
  "provenance": {
    "chain": "https://docs.monad.xyz/developer-essentials/network-information",
    "review": "../../docs/chain-data-sources.md"
  },
  "data": {
    "chain_id": 143,
    "charts": {
      "default": "https://dexscreener.com/monad/{lp_address}",
      "dexscreener": "https://dexscreener.com/monad/{lp_address}"
    },
    "dex": {
      "uniswap_v3": {
        "deployment_source": "https://developers.uniswap.org/docs/protocols/v3/deployments/v3-monad-deployments",
        "factory_abi": "UNISWAP_V3_FACTORY",
        "factory_address": "0x204faca1764b154221e35c0d20abb3c525710498",
        "name": "Uniswap V3",
        "protocol_family": "uniswap_v3",
        "protocol_version": "3",
        "router_abi": "UNISWAP_V3_ROUTER_02",
        "router_address": "0xfe31f71c1b106eac32f1a19239c9a9a72ddfb900",
        "router_variant": "SwapRouter02",
        "website": "https://app.uniswap.org/"
      }
    },
    "explorer": "https://monadvision.com/",
    "name": "Monad Mainnet",
    "rpc": [
      "https://rpc.monad.xyz"
    ],
    "stable_coins": {
      "USDC": "0x754704Bc059F8C67012fEd69BC8A327a5aafb603",
      "USDT0": "0xe7cd86e13AC4309349F30B3435a9d337750fC82D"
    },
    "weth": {
      "address": "0x3bd359C1119dA7Da1D913D1C4D2B7c461115433A",
      "name": "Wrapped MON",
      "symbol": "WMON"
    }
  }
}
