{
  "$schema": "../schemas/chain-source.schema.json",
  "schema_version": 1,
  "slug": "arbitrum",
  "verified_at": "2026-08-30",
  "provenance": {
    "chain": "https://docs.arbitrum.io/build-decentralized-apps/reference/node-providers",
    "review": "../../docs/chain-data-sources.md"
  },
  "data": {
    "chain_id": 42161,
    "charts": {
      "default": "https://dexscreener.com/arbitrum/{lp_address}",
      "dexscreener": "https://dexscreener.com/arbitrum/{lp_address}"
    },
    "dex": {
      "sushi": {
        "factory_address": "0xc35DADB65012eC5796536bD9864eD8773aBc74C4",
        "name": "SushiSwap",
        "router_address": "0x1b02dA8Cb0d097eB8D57A175b88c7D8b47997506",
        "website": "https://app.sushi.com/en/swap"
      },
      "uniswap_v3": {
        "deployment_source": "https://developers.uniswap.org/docs/protocols/v3/deployments/v3-arbitrum-deployments",
        "factory_abi": "UNISWAP_V3_FACTORY",
        "factory_address": "0x1F98431c8aD98523631AE4a59f267346ea31F984",
        "name": "Uniswap V3",
        "protocol_family": "uniswap_v3",
        "protocol_version": "3",
        "router_abi": "UNISWAP_V3_ROUTER_02",
        "router_address": "0x68b3465833fb72A70ecDF485E0e4C7bD8665Fc45",
        "router_variant": "SwapRouter02",
        "website": "https://app.uniswap.org/"
      }
    },
    "explorer": "https://arbiscan.io",
    "name": "Arbitrum One",
    "rpc": [
      "https://arb1.arbitrum.io/rpc"
    ],
    "stable_coins": {
      "USDC": "0xaf88d065e77c8cC2239327C5EDb3A432268e5831",
      "USDT0": "0xfd086bc7cd5c481dcc9c85ebe478a1c0b69fcbb9"
    },
    "weth": {
      "address": "0x82aF49447D8a07e3bd95BD0d56f35241523fBab1",
      "name": "Wrapped ETH",
      "symbol": "WETH"
    }
  }
}
