{
  "$schema": "../schemas/chain-source.schema.json",
  "schema_version": 1,
  "slug": "robinhood",
  "verified_at": "2026-08-30",
  "provenance": {
    "chain": "https://docs.robinhood.com/chain/connecting/",
    "review": "../../docs/chain-data-sources.md"
  },
  "data": {
    "chain_id": 4663,
    "charts": {
      "default": "https://dexscreener.com/robinhood/{lp_address}",
      "dexscreener": "https://dexscreener.com/robinhood/{lp_address}"
    },
    "dex": {
      "uniswap_v3": {
        "deployment_source": "https://developers.uniswap.org/docs/protocols/v3/deployments/v3-robinhood-chain-deployments",
        "factory_abi": "UNISWAP_V3_FACTORY",
        "factory_address": "0x1f7d7550b1b028f7571e69a784071f0205fd2efa",
        "name": "Uniswap V3",
        "protocol_family": "uniswap_v3",
        "protocol_version": "3",
        "router_abi": "UNISWAP_V3_ROUTER_02",
        "router_address": "0xcaf681a66d020601342297493863e78c959e5cb2",
        "router_variant": "SwapRouter02",
        "website": "https://app.uniswap.org/"
      }
    },
    "explorer": "https://robinhoodchain.blockscout.com/",
    "name": "Robinhood Chain Mainnet",
    "rpc": [
      "https://rpc.mainnet.chain.robinhood.com"
    ],
    "stable_coins": {
      "USDG.oft": "0x5fc5360D0400a0Fd4f2af552ADD042D716F1d168"
    },
    "weth": {
      "address": "0x0Bd7D308f8E1639FAb988df18A8011f41EAcAD73",
      "name": "Wrapped ETH",
      "symbol": "WETH"
    }
  }
}
