{
  "$schema": "../schemas/chain-source.schema.json",
  "schema_version": 1,
  "slug": "avalanche",
  "verified_at": "2026-08-30",
  "provenance": {
    "chain": "https://build.avax.network/docs/quick-start/networks/mainnet",
    "review": "../../docs/chain-data-sources.md"
  },
  "data": {
    "chain_id": 43114,
    "charts": {
      "default": "https://dexscreener.com/avalanche/{lp_address}",
      "dexscreener": "https://dexscreener.com/avalanche/{lp_address}"
    },
    "dex": {
      "lfj_v2_2": {
        "deployment_source": "https://developers.lfj.gg/deployment-addresses/avalanche",
        "factory_abi": "LFJ_LIQUIDITY_BOOK_V2_2_FACTORY",
        "factory_address": "0xb43120c4745967fa9b93E79C149E66B0f2D6Fe0c",
        "name": "LFJ Liquidity Book V2.2",
        "protocol_family": "lfj_liquidity_book",
        "protocol_version": "2.2",
        "router_abi": "LFJ_LIQUIDITY_BOOK_V2_2_ROUTER",
        "router_address": "0x18556DA13313f3532c54711497A8FedAC273220E",
        "website": "https://lfj.gg/avalanche/trade"
      }
    },
    "explorer": "https://snowtrace.io/",
    "name": "Avalanche C-Chain",
    "rpc": [
      "https://api.avax.network/ext/bc/C/rpc"
    ],
    "stable_coins": {
      "USDC": "0xB97EF9Ef8734C71904D8002F8b6Bc66Dd9c48a6E",
      "USDT": "0x9702230A8Ea53601f5cD2dc00fDBc13d4dF4A8c7"
    },
    "weth": {
      "address": "0xB31f66AA3C1e785363F0875A1B74E27b85FD66c7",
      "name": "Wrapped AVAX",
      "symbol": "WAVAX"
    }
  }
}
